{
  "balancedRegressionEvidence": [
    {
      "artifacts": {
        "legacyRegions": {
          "path": "benchmarks/fabrication-layer-decomposition/outputs/color-purification/cp-b-balanced_rc-a/FLD-001/regions.json.gz",
          "sha256": "955cee21c51a345619e03f4f5c058ebc4e37a52c95192e5936df8c1e07675041",
          "sizeBytes": 15365
        },
        "metrics": {
          "path": "benchmarks/fabrication-layer-decomposition/outputs/color-purification/cp-b-balanced_rc-a/FLD-001/metrics.json",
          "sha256": "5813ed890a6108ad2f3a00ac52d8ddff1a895a23ea0334ec6ceb84194b5560b5",
          "sizeBytes": 3390
        },
        "pixelLabelMap": {
          "path": "benchmarks/fabrication-layer-decomposition/outputs/color-purification/cp-b-balanced_rc-a/FLD-001/pixel_label_map.npz",
          "sha256": "fdfc682b89107c957e35ecd9836910ad0fc97bb291b66d7d84fa28a453e74089",
          "sizeBytes": 10316
        },
        "purifiedRaster": {
          "path": "benchmarks/fabrication-layer-decomposition/outputs/color-purification/cp-b-balanced_rc-a/FLD-001/purified.png",
          "sha256": "19a2a54b8aee5d664c9d44ba3c0dbc3bdcf01c4ba8bfae010f233e62c4218f6e",
          "sizeBytes": 36972
        },
        "runConfig": {
          "path": "benchmarks/fabrication-layer-decomposition/outputs/color-purification/cp-b-balanced_rc-a/FLD-001/run_config.json",
          "sha256": "8a00d45609a9ca9f79f82f9d9812d2714a51394ebf1ac4c561dc31edb80c80d2",
          "sizeBytes": 1319
        },
        "source": {
          "path": "benchmarks/fabrication-layer-decomposition/fixtures/source/FLD-001.png",
          "sha256": "430aea866099626ffb2448bab16f8c02611bc6b12735c36158816e6948efbd3a",
          "sizeBytes": 125520
        },
        "structuralLabelMap": {
          "path": "benchmarks/fabrication-layer-decomposition/outputs/color-purification/cp-b-balanced_rc-a/FLD-001/structural_label_map.npz",
          "sha256": "fdfc682b89107c957e35ecd9836910ad0fc97bb291b66d7d84fa28a453e74089",
          "sizeBytes": 10316
        }
      },
      "componentCount4": 594,
      "fixtureId": "FLD-001",
      "profile": "cp-b-balanced_rc-a",
      "regionCount": 497,
      "status": "REGRESSION_EVIDENCE_ONLY"
    },
    {
      "artifacts": {
        "legacyRegions": {
          "path": "benchmarks/fabrication-layer-decomposition/outputs/color-purification/cp-b-balanced_rc-a/FLD-002/regions.json.gz",
          "sha256": "002e775dd9a5bbd0aaba3ddd693e9ee12b0f08dd32d939ba193ac76259445efc",
          "sizeBytes": 3232
        },
        "metrics": {
          "path": "benchmarks/fabrication-layer-decomposition/outputs/color-purification/cp-b-balanced_rc-a/FLD-002/metrics.json",
          "sha256": "2e5d3c242ec6e138a521d89a7496e6510282e848196bb49e1d650abccebadba9",
          "sizeBytes": 3390
        },
        "pixelLabelMap": {
          "path": "benchmarks/fabrication-layer-decomposition/outputs/color-purification/cp-b-balanced_rc-a/FLD-002/pixel_label_map.npz",
          "sha256": "58764f0451ce792a202b7dcd62cb36cf3cb380bda9dd44ef591192ad7f28cf9b",
          "sizeBytes": 7089
        },
        "purifiedRaster": {
          "path": "benchmarks/fabrication-layer-decomposition/outputs/color-purification/cp-b-balanced_rc-a/FLD-002/purified.png",
          "sha256": "33bf36fd066ec9806bb44544749d9280446892641803941e85e117ede32da764",
          "sizeBytes": 14747
        },
        "runConfig": {
          "path": "benchmarks/fabrication-layer-decomposition/outputs/color-purification/cp-b-balanced_rc-a/FLD-002/run_config.json",
          "sha256": "8168f8fc2ab86353fc00aed8e9e51a3375cb3e4b244dc5f894963fe8f985cb25",
          "sizeBytes": 1319
        },
        "source": {
          "path": "benchmarks/fabrication-layer-decomposition/fixtures/source/FLD-002.png",
          "sha256": "6d3e9aca43654da4e630e4e72d236eccefac439f0c4f498e1e264b2575c3e3ab",
          "sizeBytes": 210658
        },
        "structuralLabelMap": {
          "path": "benchmarks/fabrication-layer-decomposition/outputs/color-purification/cp-b-balanced_rc-a/FLD-002/structural_label_map.npz",
          "sha256": "58764f0451ce792a202b7dcd62cb36cf3cb380bda9dd44ef591192ad7f28cf9b",
          "sizeBytes": 7089
        }
      },
      "componentCount4": 86,
      "fixtureId": "FLD-002",
      "profile": "cp-b-balanced_rc-a",
      "regionCount": 74,
      "status": "REGRESSION_EVIDENCE_ONLY"
    },
    {
      "artifacts": {
        "legacyRegions": {
          "path": "benchmarks/fabrication-layer-decomposition/outputs/color-purification/cp-b-balanced_rc-a/FLD-003/regions.json.gz",
          "sha256": "efe3e5eb18df62f3c5a4b4d5959f2aef31229a017ad17a089403dbeecf717687",
          "sizeBytes": 1162
        },
        "metrics": {
          "path": "benchmarks/fabrication-layer-decomposition/outputs/color-purification/cp-b-balanced_rc-a/FLD-003/metrics.json",
          "sha256": "8494ea56c7f880fb47b9a11260b2f94324a01991f9915a61bab865a13a5f384e",
          "sizeBytes": 3380
        },
        "pixelLabelMap": {
          "path": "benchmarks/fabrication-layer-decomposition/outputs/color-purification/cp-b-balanced_rc-a/FLD-003/pixel_label_map.npz",
          "sha256": "18fec1fad0ccbf72fbb3cc4c511e6d7c616f33a98d6e9b1917b33b3e08c7ea07",
          "sizeBytes": 16154
        },
        "purifiedRaster": {
          "path": "benchmarks/fabrication-layer-decomposition/outputs/color-purification/cp-b-balanced_rc-a/FLD-003/purified.png",
          "sha256": "a82d6920aa00260fbdfcdf8cb9251e6b5a848fa470e6dca6894301012cd5dfa8",
          "sizeBytes": 92805
        },
        "runConfig": {
          "path": "benchmarks/fabrication-layer-decomposition/outputs/color-purification/cp-b-balanced_rc-a/FLD-003/run_config.json",
          "sha256": "fb2f2d144eb70cfce4ff32e08ef41ce14550103fdcc942fbce6bcf0c21a77746",
          "sizeBytes": 1319
        },
        "source": {
          "path": "benchmarks/fabrication-layer-decomposition/fixtures/source/FLD-003.png",
          "sha256": "215571f797076dd34e42df2c9786178010f0495b5e06bfdf2023c0e1ff99881c",
          "sizeBytes": 363655
        },
        "structuralLabelMap": {
          "path": "benchmarks/fabrication-layer-decomposition/outputs/color-purification/cp-b-balanced_rc-a/FLD-003/structural_label_map.npz",
          "sha256": "18fec1fad0ccbf72fbb3cc4c511e6d7c616f33a98d6e9b1917b33b3e08c7ea07",
          "sizeBytes": 16154
        }
      },
      "componentCount4": 45,
      "fixtureId": "FLD-003",
      "profile": "cp-b-balanced_rc-a",
      "regionCount": 18,
      "status": "REGRESSION_EVIDENCE_ONLY"
    },
    {
      "artifacts": {
        "legacyRegions": {
          "path": "benchmarks/fabrication-layer-decomposition/outputs/color-purification/cp-b-balanced_rc-a/FLD-004/regions.json.gz",
          "sha256": "6f6d130ac41c7c9e6ed840ab2b3f0ab9ed52f0db770c98b62dc731e877776972",
          "sizeBytes": 16421
        },
        "metrics": {
          "path": "benchmarks/fabrication-layer-decomposition/outputs/color-purification/cp-b-balanced_rc-a/FLD-004/metrics.json",
          "sha256": "087a74dbe56c5868aedc19de31102e0d199bc15ae8f43c02e1998bf40e2d94c2",
          "sizeBytes": 3429
        },
        "pixelLabelMap": {
          "path": "benchmarks/fabrication-layer-decomposition/outputs/color-purification/cp-b-balanced_rc-a/FLD-004/pixel_label_map.npz",
          "sha256": "9331c869d3542599dbfe5af5c60d2ba4f490dc889f3cf3644eee7fd8cafc7ebd",
          "sizeBytes": 21314
        },
        "purifiedRaster": {
          "path": "benchmarks/fabrication-layer-decomposition/outputs/color-purification/cp-b-balanced_rc-a/FLD-004/purified.png",
          "sha256": "7d1a4e472d3b390d783536a13a9013b4839ee3d8e0efbdc8cb73607e028e62a4",
          "sizeBytes": 71704
        },
        "runConfig": {
          "path": "benchmarks/fabrication-layer-decomposition/outputs/color-purification/cp-b-balanced_rc-a/FLD-004/run_config.json",
          "sha256": "d006f942906854a45ddec271ec806a7eb51e2e124801e19da50b5807fe8bfb43",
          "sizeBytes": 1319
        },
        "source": {
          "path": "benchmarks/fabrication-layer-decomposition/fixtures/source/FLD-004.png",
          "sha256": "84991c54800da573985072149fe667048e059aaad1d42bfc2923a27859f90d28",
          "sizeBytes": 438949
        },
        "structuralLabelMap": {
          "path": "benchmarks/fabrication-layer-decomposition/outputs/color-purification/cp-b-balanced_rc-a/FLD-004/structural_label_map.npz",
          "sha256": "9331c869d3542599dbfe5af5c60d2ba4f490dc889f3cf3644eee7fd8cafc7ebd",
          "sizeBytes": 21314
        }
      },
      "componentCount4": 746,
      "fixtureId": "FLD-004",
      "profile": "cp-b-balanced_rc-a",
      "regionCount": 513,
      "status": "REGRESSION_EVIDENCE_ONLY"
    },
    {
      "artifacts": {
        "legacyRegions": {
          "path": "benchmarks/fabrication-layer-decomposition/outputs/color-purification/cp-b-balanced_rc-a/FLD-005/regions.json.gz",
          "sha256": "1150755bc6358dc2540433d94a18dfbcaf8a9a2242f4589d1090860a82522b89",
          "sizeBytes": 6014
        },
        "metrics": {
          "path": "benchmarks/fabrication-layer-decomposition/outputs/color-purification/cp-b-balanced_rc-a/FLD-005/metrics.json",
          "sha256": "9ca17ba6c9aa127b122ae00298fb4679a6b57fcb41939420718e5bcda165c597",
          "sizeBytes": 3376
        },
        "pixelLabelMap": {
          "path": "benchmarks/fabrication-layer-decomposition/outputs/color-purification/cp-b-balanced_rc-a/FLD-005/pixel_label_map.npz",
          "sha256": "e77e6444e317f1d611fb9a93ad5ca0ca7104880fe8497674e97db82f880babaa",
          "sizeBytes": 7369
        },
        "purifiedRaster": {
          "path": "benchmarks/fabrication-layer-decomposition/outputs/color-purification/cp-b-balanced_rc-a/FLD-005/purified.png",
          "sha256": "39ca1a414233ba21d3eb40665c28667a42661cdca2b8a3643572c53d31ac9d0f",
          "sizeBytes": 39808
        },
        "runConfig": {